{
  "issue_number": 24,
  "date_window": {
    "from": "2026-08-29",
    "to": "2026-09-04"
  },
  "generated_at": "2026-09-04T09:40:00Z",
  "state_snapshot": {
    "last_lead_topic": "Ways of working",
    "last_lead_topics_3issues": [
      "Ways of working (Issue 23 deep dive, user-directed topic)",
      "Ways of working",
      "Wider engineering landscape"
    ],
    "last_outside_in_company": "Duolingo",
    "outside_in_history": [
      "Issue 1 Monzo",
      "Issue 6 Revolut",
      "Issue 7 Ramp",
      "Issue 9 Cloudflare",
      "Issue 10 Wise",
      "Issue 11 Linear",
      "Issue 12 incident.io",
      "Issue 13 Vercel",
      "Issue 14 Honeycomb",
      "Issue 15 Datadog",
      "Issue 16 The Finanser (Chris Skinner)",
      "Issue 17 Kent Beck",
      "Issue 20 Shopify",
      "Issue 21 Klarna",
      "Issue 22 Duolingo"
    ],
    "current_in_practice_season": "Making technical decisions when not the SME",
    "in_practice_history": [
      "Issue 11 Diogo Matias (Monzo)",
      "Issue 12 Jay Vilalta",
      "Issue 13 Thiago Ghisi",
      "Issue 14 Allison & Jacobs (Twilio)",
      "Issue 15 Stephane Moreau",
      "Issue 16 Niklas Gustavsson (Spotify)",
      "Issue 17 Avani Prabhakar (Atlassian)",
      "Issue 19 Mahendran Vasagam (Slack)",
      "Issue 20 Ferit Topcu (Zenjob)",
      "Issue 21 Ben Balter (evergreen)",
      "Issue 22 Jay Rungta (YouTube) - season week 1, resumes at Issue 24"
    ]
  },
  "beats": [
    {
      "beat": "management_teams",
      "queries_run": [
        "CATCH-ALL (name-agnostic, v1.37): \"tech company cuts engineering roles September 2026\"",
        "CATCH-ALL (name-agnostic, v1.37): \"engineering team restructure September 2026 reorganisation software company\"",
        "CATCH-ALL (name-agnostic, v1.37): \"software company cuts engineering roles announcement September 2026 AI efficiency\"",
        "layoffs announced week of 1 September 2026 tech",
        "Nike layoffs 1400 technology roles announcement",
        "Snap layoffs 1,000 workers 16% engineering September 2026",
        "Microsoft buyout 7% employees retirement program senior director 2026",
        "\"September 2026\" engineering leadership hiring managers span of control news",
        "WebFetch index sweep: computerworld.com tech-layoffs timeline, filtered to 22 Aug - 4 Sep 2026",
        "Uber layoffs 3,300 10% workforce Khosrowshahi September 2026 engineering",
        "Uber return to office 1% remote policy engineering reaction September 2026",
        "Oracle layoffs September 2026 7,000 cloud engineering jobs",
        "engineering management essay September 2026 performance reviews hiring 1:1s promotion non-AI leadership",
        "CROSS-BEAT ENTITY SWEEP: \"DoorDash layoffs workforce restructure engineering organisation 2026\" (DoorDash surfaced under ways_of_working via Flux; swept against management/workforce framing - no in-window result)",
        "CROSS-BEAT ENTITY SWEEP: \"Nvidia engineering workforce restructure hiring 2026 organisation\" (Nvidia surfaced under banking_fintech_loyalty/wider-landscape via the Hugging Face deal; swept against management framing - Nvidia is hiring, not cutting)"
      ],
      "candidates": [
        {
          "headline": "Uber cuts 3,300 roles and rebuilds its org chart around fewer layers, fewer managers and almost no micro-teams",
          "source_name": "TechCrunch",
          "source_url": "https://techcrunch.com/2026/09/02/uber-is-laying-off-10-of-staff-or-3300-people/",
          "published_date": "2026-09-02",
          "beat": "management_teams",
          "summary": "Uber announced on 2 September that it is cutting about 3,300 roles, roughly 10% of global headcount, in its largest reduction since the pandemic. The reshape is explicitly structural rather than performance-based: manager roles fall by about 20%, teams of only one or two people are cut by half, staff more than seven layers from the CEO are reduced, and Core Services Engineering and Science are merged into one organisation. Delivery operations across restaurants, retail and direct are consolidated into single global, regional and country teams, and fully remote working drops to about 1% of staff.",
          "so_what": "It is the clearest published example this year of a large engineering organisation treating layers, manager ratios and minimum viable team size as the thing being redesigned - which is precisely the conversation a director is about to have when asked to flatten their own structure.",
          "tier_guess": "lead-worthy",
          "uk_me_relevance": "medium",
          "narrative_tension": "high",
          "urgency_classification": "decide_this_month",
          "secondary_sources": [
            "https://hrexecutive.com/uber-cuts-10-of-workforce-tightens-return-to-office-rules/",
            "https://www.aljazeera.com/economy/2026/9/2/uber-lays-off-3300-employees-in-largest-cuts-since-the-pandemic",
            "https://qz.com/uber-layoffs-management-restructuring-3300-jobs-090226"
          ],
          "notes": "STRONGEST MANAGEMENT & TEAMS CANDIDATE OF THE WINDOW and directly answers the Phase 2 preference flagged for this run (leads of the last three issues were Ways of working x2 and Wider engineering landscape). NOT on the no-repeat-anchor list. NOTE A DISCREPANCY FOR PHASE 3 TO PIN: TechCrunch renders the 20% figure as a cut to manager roles plus a separate removal of staff more than seven layers down; HR Executive renders it as a 20% reduction in employees seven or more layers from the CEO. Verify against Khosrowshahi's email text before printing either. AI is NOT the stated driver here - Uber cites complexity and scale - which makes this a useful non-AI-substrate anchor for the v1.32 reader-experience count and the v1.35 long-form rule.",
          "jargon_terms": [
            "span of control",
            "layers",
            "individual contributor (IC)",
            "micro-team"
          ],
          "chartable_data": "Process-flow or before/after comparison: the four named structural levers (manager roles -20%, one-and-two-person teams -50%, layers beyond seven trimmed, remote 1%) sit naturally in a compare-table or a four-step .process-flow. Also chartable against the wider window: Uber 3,300 / PayPal 220-600 India + 164 Ireland / Apple ~250 / Zomato ~250 as a single-week bar.",
          "event_or_essay": "news_event"
        },
        {
          "headline": "Khosrowshahi ends remote working for all but about 1% of Uber staff in the same memo that cuts the managers",
          "source_name": "HR Executive",
          "source_url": "https://hrexecutive.com/uber-cuts-10-of-workforce-tightens-return-to-office-rules/",
          "published_date": "2026-09-03",
          "beat": "management_teams",
          "summary": "Alongside the 3,300 cuts, Uber reduced fully remote employees to roughly 1% of the workforce, asked remaining remote staff to relocate nearer offices, and said it will enforce its existing three-days-a-week hybrid policy more strictly. The CEO framed the combined change as producing \"a simpler org chart geared toward building versus managing\", and stressed the cuts reflected structure rather than individual performance.",
          "so_what": "Location policy and org-shape policy arriving in one memo is the pattern a leader has to be ready to explain to their own team, because the two get read as a single message about trust whether or not that was intended.",
          "tier_guess": "quick-take-worthy",
          "uk_me_relevance": "medium",
          "narrative_tension": "medium",
          "urgency_classification": "decide_this_month",
          "secondary_sources": [
            "https://www.thehrdigest.com/ubers-rto-policy-joins-the-crowd-of-employers-shunning-remote-work/"
          ],
          "notes": "SAME EVENT AS THE UBER LEAD CANDIDATE - Phase 2 must not run both as separate anchors (that would breach within-issue concern diversity and read as double-coverage). Recorded separately because the RTO angle may be the better Quick Take if a different story takes the Lead. Non-AI substrate.",
          "jargon_terms": [
            "hybrid policy",
            "return to office (RTO)"
          ],
          "event_or_essay": "news_event"
        },
        {
          "headline": "PayPal cuts technology and engineering roles across three Indian cities and Ireland on the same day, with the reported number four times the company's own",
          "source_name": "Storyboard18",
          "source_url": "https://www.storyboard18.com/brand-marketing/paypal-layoffs-2026-600-india-jobs-reportedly-cut-amid-global-restructuring-109622.htm",
          "published_date": "2026-09-03",
          "beat": "management_teams",
          "summary": "PayPal cut roles on 31 August across Chennai, Bengaluru and Hyderabad, spanning technology, engineering, operations, payments and finance. Reports put the India figure at about 600; PayPal disputes this and says about 220 were affected - 10% versus 4% of an India workforce of more than 6,000. About 164 Irish employees, roughly 12% of the local workforce, were let go the same day. The cuts sit inside a previously announced multi-year transformation targeting a 20% workforce reduction over two to three years and at least $1.5bn in gross run-rate savings.",
          "so_what": "A payments company cutting engineering capacity in its offshore delivery centres is the supply-side of the same market a UK or Gulf fintech hires into, and the disputed headcount shows how unreliable the public numbers are when leaders benchmark their own ratios.",
          "tier_guess": "quick-take-worthy",
          "uk_me_relevance": "high",
          "narrative_tension": "medium",
          "urgency_classification": "decide_this_month",
          "secondary_sources": [